{
  "environment": "environment/the-meadow",
  "instances": [
    {
      "key": "instance-0df0941e67071490",
      "object": "app-e21ff1375a82f02a",
      "pinned": false,
      "position": [
        29.071,
        0,
        41.064
      ],
      "quaternion": [
        0,
        0.47243288566419667,
        0,
        -0.8813666481907516
      ],
      "scale": [
        1,
        1,
        1
      ]
    },
    {
      "key": "instance-110076168f01e034",
      "object": "apps/tree-02",
      "pinned": false,
      "position": [
        18.807,
        0,
        39.392
      ],
      "quaternion": [
        0,
        0.5097463315908249,
        0,
        0.860324751143251
      ],
      "scale": [
        1,
        1,
        1
      ]
    },
    {
      "key": "instance-15f2e4cdec086ec9",
      "object": "app-659202a22af19486",
      "pinned": false,
      "position": [
        35.321,
        0,
        45.664
      ],
      "quaternion": [
        0,
        0.7484552707566913,
        0,
        0.6631852740196573
      ],
      "scale": [
        1,
        1,
        1
      ]
    },
    {
      "key": "instance-210954da573766a4",
      "object": "apps/tree-02",
      "pinned": false,
      "position": [
        8.585,
        0,
        -12.505
      ],
      "quaternion": [
        0,
        0.32264348423925987,
        0,
        0.9465205661146251
      ],
      "scale": [
        1,
        1,
        1
      ]
    },
    {
      "key": "instance-21441e1ddca553dd",
      "object": "app-364acd979ee743ef",
      "pinned": false,
      "position": [
        35.35656978624508,
        0.12096717663691103,
        12.890817243430913
      ],
      "quaternion": [
        0,
        -0.766044443118978,
        0,
        0.6427876096865394
      ],
      "scale": [
        1,
        1,
        1
      ]
    },
    {
      "key": "instance-22b491a9c6b9c641",
      "object": "app-3645ed5fa140e089",
      "pinned": false,
      "position": [
        68.595,
        0,
        20.963
      ],
      "quaternion": [
        0,
        0.9998392754789822,
        0,
        0.01792827960691868
      ],
      "scale": [
        1,
        1,
        1
      ]
    },
    {
      "key": "instance-343cacb0fd37633d",
      "object": "app-ad9a35e5852a2887",
      "pinned": false,
      "position": [
        31.92479552244702,
        1.8334094502795224,
        4.622366406268535
      ],
      "quaternion": [
        0,
        -0.13052619222005157,
        0,
        0.9914448613738104
      ],
      "scale": [
        1,
        1,
        1
      ]
    },
    {
      "key": "instance-3a5417bf507561e0",
      "object": "app-a027640ca3a2f9ef",
      "pinned": false,
      "position": [
        26.831,
        0,
        33.163
      ],
      "quaternion": [
        0,
        0.18161888812735377,
        0,
        0.9833689945668329
      ],
      "scale": [
        1,
        1,
        1
      ]
    },
    {
      "key": "instance-44d3fe20fa0af52d",
      "object": "apps/tree-05",
      "pinned": false,
      "position": [
        16.551,
        0,
        -13.579
      ],
      "quaternion": [
        0,
        0.9207172620377889,
        0,
        0.3902303465719158
      ],
      "scale": [
        1,
        1,
        1
      ]
    },
    {
      "key": "instance-4b91367c9b9b5755",
      "object": "app-997c9339d8cb7ae1",
      "pinned": false,
      "position": [
        -10.027565348610167,
        0.0034360897594045703,
        2.0688491900698796
      ],
      "quaternion": [
        0,
        0.7071067811865475,
        0,
        0.7071067811865476
      ],
      "scale": [
        1,
        1,
        1
      ]
    },
    {
      "key": "instance-4dbad7e53bc1d7ed",
      "object": "app-b9bfa598eafc7b7a",
      "pinned": false,
      "position": [
        24.678573047540677,
        1.4439543050357897,
        19.42204928446847
      ],
      "quaternion": [
        0,
        -0.17364817766693025,
        0,
        0.9848077530122081
      ],
      "scale": [
        1.4516037803168003,
        1.4516037803168003,
        1.4516037803168003
      ]
    },
    {
      "key": "instance-59d19b22433f91a0",
      "object": "app-7e9e39cf94d2ca40",
      "pinned": false,
      "position": [
        19.125,
        0,
        31.867
      ],
      "quaternion": [
        0,
        0.7998541707869822,
        0,
        0.6001943897394153
      ],
      "scale": [
        1,
        1,
        1
      ]
    },
    {
      "key": "instance-5b4521aefcb55dca",
      "object": "app-3645ed5fa140e089",
      "pinned": false,
      "position": [
        67.798,
        0,
        9.522
      ],
      "quaternion": [
        0,
        0.2831196969780087,
        0,
        -0.9590845829138744
      ],
      "scale": [
        1,
        1,
        1
      ]
    },
    {
      "key": "instance-60fc314f19f512c2",
      "object": "app-e21ff1375a82f02a",
      "pinned": false,
      "position": [
        54.103,
        0,
        24.93
      ],
      "quaternion": [
        0,
        0.7252101307292685,
        0,
        -0.6885276074985209
      ],
      "scale": [
        1,
        1,
        1
      ]
    },
    {
      "key": "instance-618028d74cb62876",
      "object": "app-a027640ca3a2f9ef",
      "pinned": false,
      "position": [
        60.581,
        0,
        19.045
      ],
      "quaternion": [
        0,
        0.28415888321004334,
        0,
        -0.9587772051383058
      ],
      "scale": [
        1,
        1,
        1
      ]
    },
    {
      "key": "instance-667415a1a914685d",
      "object": "apps/tree-03",
      "pinned": false,
      "position": [
        52.73,
        0,
        34.224
      ],
      "quaternion": [
        0,
        0.9273937663751354,
        0,
        -0.37408662377655355
      ],
      "scale": [
        1,
        1,
        1
      ]
    },
    {
      "key": "instance-7429dba09d0b39e3",
      "object": "apps/tree-04",
      "pinned": false,
      "position": [
        22.4,
        0,
        46.15
      ],
      "quaternion": [
        0,
        0.8708896904079844,
        0,
        0.4914785317194284
      ],
      "scale": [
        1,
        1,
        1
      ]
    },
    {
      "key": "instance-7699029267c49d7a",
      "object": "apps/tree-03",
      "pinned": false,
      "position": [
        39.388,
        0,
        36.368
      ],
      "quaternion": [
        0,
        0.5496768998270225,
        0,
        -0.8353773433584092
      ],
      "scale": [
        1,
        1,
        1
      ]
    },
    {
      "key": "instance-78091e6780c23968",
      "object": "app-659202a22af19486",
      "pinned": false,
      "position": [
        62.432,
        0,
        1.593
      ],
      "quaternion": [
        0,
        0.9268211849337649,
        0,
        0.3755029842197955
      ],
      "scale": [
        1,
        1,
        1
      ]
    },
    {
      "key": "instance-7f516782574e02d0",
      "object": "app-7e9e39cf94d2ca40",
      "pinned": false,
      "position": [
        50.342,
        0,
        -2.959
      ],
      "quaternion": [
        0,
        0.6058007630151201,
        0,
        -0.7956163871680235
      ],
      "scale": [
        1,
        1,
        1
      ]
    },
    {
      "key": "instance-897127c6a07338ab",
      "object": "apps/tree-04",
      "pinned": false,
      "position": [
        4.771,
        0,
        23.062
      ],
      "quaternion": [
        0,
        0.6735296032357969,
        0,
        0.7391602489075221
      ],
      "scale": [
        1,
        1,
        1
      ]
    },
    {
      "key": "instance-8e7d871552f18533",
      "object": "app-e21ff1375a82f02a",
      "pinned": false,
      "position": [
        24.357,
        0,
        -9.77
      ],
      "quaternion": [
        0,
        0.5568519288303357,
        0,
        0.8306117801704564
      ],
      "scale": [
        1,
        1,
        1
      ]
    },
    {
      "key": "instance-95b0b7ac57bef15f",
      "object": "apps/tree-03",
      "pinned": false,
      "position": [
        51.29,
        0,
        5.42
      ],
      "quaternion": [
        0,
        0.8478308359616854,
        0,
        -0.5302667947293227
      ],
      "scale": [
        1,
        1,
        1
      ]
    },
    {
      "key": "instance-a21e95b2c8170186",
      "object": "apps/tree-05",
      "pinned": false,
      "position": [
        54.448,
        0,
        42.897
      ],
      "quaternion": [
        0,
        0.9886957178443858,
        0,
        -0.1499359113627372
      ],
      "scale": [
        1,
        1,
        1
      ]
    },
    {
      "key": "instance-a37209fcaa7cdccc",
      "object": "app-7e9e39cf94d2ca40",
      "pinned": false,
      "position": [
        57.616,
        0,
        -5.244
      ],
      "quaternion": [
        0,
        0.6867022246059876,
        0,
        0.7269388246071244
      ],
      "scale": [
        1,
        1,
        1
      ]
    },
    {
      "key": "instance-ae75e9b6cf58b518",
      "object": "apps/tree-05",
      "pinned": false,
      "position": [
        61.736,
        0,
        35.952
      ],
      "quaternion": [
        0,
        0.7518259101245948,
        0,
        -0.6593616616587021
      ],
      "scale": [
        1,
        1,
        1
      ]
    },
    {
      "key": "instance-b663061a773eb358",
      "object": "app-659202a22af19486",
      "pinned": false,
      "position": [
        61.706,
        0,
        26.58
      ],
      "quaternion": [
        0,
        0.5566150568059149,
        0,
        -0.8307705330215727
      ],
      "scale": [
        1,
        1,
        1
      ]
    },
    {
      "key": "instance-ce232a6a99244dc3",
      "object": "app-a027640ca3a2f9ef",
      "pinned": false,
      "position": [
        46.577,
        0,
        39.678
      ],
      "quaternion": [
        0,